{
  "schema_version": "1.0",
  "feature_id": "003",
  "agent_role": "ba",
  "phase": "ba",
  "payload_type": "result",
  "timestamp": "2026-05-12T14:08:01Z",
  "body": {
    "artifacts": {
      "spec_path": "specs/003-search-bar/spec.md",
      "plan_path": "specs/003-search-bar/plan.md",
      "tasks_path": "specs/003-search-bar/tasks.md",
      "analyze_path": "specs/003-search-bar/analysis.md",
      "analyze_severity_summary": {"critical": 0, "high": 0, "medium": 0, "low": 2}
    },
    "ba_done": true
  }
}
